post_id,image_url,page_url,title,tags,author,published,date_taken,source
55079451272,https://live.staticflickr.com/65535/55079451272_c1d077b8b3_m.jpg,https://www.flickr.com/photos/ericvdb/55079451272/,PXL_20260201_005230019.RAW-01.MP.COVER-Edit,belize cayo food lodge blackrocklodge,"nobody@flickr.com (""ericvdb"")",2026-02-06T00:07:10Z,2026-01-31T18:52:30-08:00,flickr_public_feed
55080440898,https://live.staticflickr.com/65535/55080440898_5f7b161bd6_m.jpg,https://www.flickr.com/photos/26747591@N08/55080440898/,Symi Harbour Front (Greece) Olympus OM-1 & Olympus M.Zuiko 25mm f1.8 Prime Lens,greece greek grecia greka greekisland gr greektown greekholiday greekcoastline symisouthaegeanisland symiislandgreece symi symiharbour dodecanese dodecaneseisland hellas hellenic travel traveldestination olympus olympusmft olympusm43 olympusmirrorless olympusdigitalom1 olympusom1camera om1 micro43 microfourthird microfourthirds microfourthirdlens m43 m43travel mirrorless mirrorlessfullframe mircofourthird olympusmicro43 olympusmicrofourthirds seascape,"nobody@flickr.com (""markdbaynham"")",2026-02-05T22:34:23Z,2025-05-23T13:04:09-08:00,flickr_public_feed
55080531159,https://live.staticflickr.com/65535/55080531159_e7497a5c90_m.jpg,https://www.flickr.com/photos/204019818@N07/55080531159/,Evening Lights in the Alps,winter snow alps mountainvillage chalet cabin balcony cozy evening lights warmvscold mountains village travel travelphotography moody cinematic filmlook texture rockcliff nature outdoor fujifim fujifilmxt30 fujixseries wintermood landscapephotography moodytones cinematicphotography storytelling atmosphere filmphotographylook,"nobody@flickr.com (""megaimar13008"")",2026-02-05T22:57:41Z,2026-01-10T17:28:07-08:00,flickr_public_feed
55080304771,https://live.staticflickr.com/65535/55080304771_e51e0520b4_m.jpg,https://www.flickr.com/photos/ericvdb/55080304771/,PXL_20260130_225845163.RAW-01.MP.COVER-Edit,belizecity belize food drink alcohol pattyrippah,"nobody@flickr.com (""ericvdb"")",2026-02-06T00:06:24Z,2026-01-30T16:58:45-08:00,flickr_public_feed
55080654900,https://live.staticflickr.com/65535/55080654900_d775542bdc_m.jpg,https://www.flickr.com/photos/stillunusual/55080654900/,Futami Okitama Shrine,japan japantrip japantravel mie mieprefecture 三重県 ise shrine shintoshrine futamiokitamashrine 二見興玉神社 futamiokitamajinja holiday vacation travel travelphotography travelphoto travelphotograph 2025,"nobody@flickr.com (""stillunusual"")",2026-02-05T23:20:01Z,2025-12-14T15:09:53-08:00,flickr_public_feed
55079418767,https://live.staticflickr.com/65535/55079418767_45ef393db8_m.jpg,https://www.flickr.com/photos/96541566@N06/55079418767/,2025-03-26_09-22-27_PT_Lisbon_JHe_N9,europe portugal portugueserepublic repúblicaportuguesa iberianpeninsula southwesterneurope lisbon lisboa city urban history architecture modern glass concrete parquedasnações park trees vegetation relax water fountain expo98worldsfair artwork mosaic art streets buildings houses attraction travel tourism gmic gimp,"nobody@flickr.com (""Juhele_CZ"")",2026-02-05T23:32:55Z,2025-03-26T09:22:27-08:00,flickr_public_feed
55080571159,https://live.staticflickr.com/65535/55080571159_dda09f5612_m.jpg,https://www.flickr.com/photos/harold_brown/55080571159/,Highway A-384,fall morning outdoor sky throughthewindshield travel bhagavideocom haroldbrowncom harolddashbrowncom highway iphone16promax outside photosbhagavideocom road vanishingpoint wwwflickrcomphotosharoldbrown haroldbrown,"nobody@flickr.com (""Harold Brown"")",2026-02-05T23:29:49Z,2025-09-22T09:51:59-08:00,flickr_public_feed
55080692040,https://live.staticflickr.com/65535/55080692040_2180386dd7_m.jpg,https://www.flickr.com/photos/paulocs/55080692040/,Aline Calixto,aline calixto paulo santos portrait show performance samyang 135mm,"nobody@flickr.com (""laspie21"")",2026-02-05T23:51:27Z,2025-07-25T21:17:22-08:00,flickr_public_feed
55080254206,https://live.staticflickr.com/65535/55080254206_6eca8cf81c_m.jpg,https://www.flickr.com/photos/hansmichaeltappen/55080254206/,"ArchivTappen46_21 Porträt, Junge, Einschulung, Volkmannsdorf, 1930er",archivhansmichaeltappen archiv46 porträt junge einschulung zuckertüte thüringen 1930er originalfoto schwarzweisfoto fotorahmen portrait boy schoolenrollment sugarcone thuringia 1930s originalphoto blackandwhitephoto photoframe,"nobody@flickr.com (""Hans-Michael Tappen"")",2026-02-05T22:36:28Z,2017-07-12T23:48:40-08:00,flickr_public_feed
55080246836,https://live.staticflickr.com/65535/55080246836_f21c55feca_m.jpg,https://www.flickr.com/photos/26747591@N08/55080246836/,Symi Harbour (South Dodecanese - Greece) OM-1 & M.Zuiko 12-45mm F4 PRO Zoom,greece greek grecia greka greekisland gr greektown greekholiday greekcoastline symisouthaegeanisland symiislandgreece symi symiharbour dodecanese dodecaneseisland hellas hellenic travel traveldestination olympus olympusmft olympusm43 olympusmirrorless olympusdigitalom1 olympusom1camera om1 micro43 microfourthird microfourthirds microfourthirdlens m43 m43travel mirrorless mirrorlessfullframe mircofourthird olympusmicro43 olympusmicrofourthirds seascape,"nobody@flickr.com (""markdbaynham"")",2026-02-05T22:34:21Z,2025-05-28T06:19:59-08:00,flickr_public_feed
55080494048,https://live.staticflickr.com/65535/55080494048_3e6b432430_m.jpg,https://www.flickr.com/photos/stillunusual/55080494048/,Meoto Iwa,japan japantrip japantravel mie mieprefecture 三重県 ise isebay shrine shintoshrine futamiokitamashrine 二見興玉神社 futamiokitamajinja meotoiwa marriedcouplerocks shimenawa holiday vacation travel travelphotography travelphoto travelphotograph 2025,"nobody@flickr.com (""stillunusual"")",2026-02-05T23:19:57Z,2025-12-14T14:55:27-08:00,flickr_public_feed
55080531483,https://live.staticflickr.com/65535/55080531483_3654912382_m.jpg,https://www.flickr.com/photos/ericvdb/55080531483/,PXL_20260130_230235146.RAW-01.MP.COVER-Edit,food belize taco belizecity,"nobody@flickr.com (""ericvdb"")",2026-02-06T00:06:23Z,2026-01-30T17:02:35-08:00,flickr_public_feed
55080654935,https://live.staticflickr.com/65535/55080654935_9c4276d9f3_m.jpg,https://www.flickr.com/photos/stillunusual/55080654935/,Meoto Iwa,japan japantrip japantravel mie mieprefecture 三重県 ise isebay shrine shintoshrine futamiokitamashrine 二見興玉神社 futamiokitamajinja meotoiwa marriedcouplerocks shimenawa holiday vacation travel travelphotography travelphoto travelphotograph 2025,"nobody@flickr.com (""stillunusual"")",2026-02-05T23:20:00Z,2025-12-14T15:07:34-08:00,flickr_public_feed
55080445118,https://live.staticflickr.com/65535/55080445118_51e129bf37_m.jpg,https://www.flickr.com/photos/26747591@N08/55080445118/,Colourful Houses - Symi Harbour Front (Greece) OM-1 & M.Zuiko 25mm f1.8 Prime Lens,greece greek grecia greka greekisland gr greektown greekholiday greekcoastline symisouthaegeanisland symiislandgreece symi symiharbour dodecanese dodecaneseisland hellas hellenic travel traveldestination olympus olympusmft olympusm43 olympusmirrorless olympusdigitalom1 olympusom1camera om1 micro43 microfourthird microfourthirds microfourthirdlens m43 m43travel mirrorless mirrorlessfullframe mircofourthird olympusmicro43 olympusmicrofourthirds seascape,"nobody@flickr.com (""markdbaynham"")",2026-02-05T22:34:06Z,2025-05-23T13:10:02-08:00,flickr_public_feed
55079438402,https://live.staticflickr.com/65535/55079438402_dea4d7de91_m.jpg,https://www.flickr.com/photos/166045898@N08/55079438402/,Seek asylum,ricohflexnewdia ricohflexdia ricohflex ricohflexdiacord newdia newdiacord ricoh ricohdiacord kodaktmax400 kodaktmax tmax400 tmax kodak 6x6 6x6format 120film 400asa 400iso blackandwhitephotography monochromephotography analogportrait blackandwhiteportrait monochromeportrait mediumformat square squareformat monochromediumformat sqa portrait filmportrait analogphotography filmphotography analogfilm woman naturallight japanesewoman tokyo reflexbiobjectif tlr tlrcamera twinlensreflexcamera twinlensreflex モノクロ モノクロ写真 白黒 自然光 フィルム写真 フィルム 白黒写真 日本 日本人女性 日本女性 中判カメラ スクエア 正方形 二眼レフカメラ リコーフレックスダイヤ リコーフレックス リコー 東京,"nobody@flickr.com (""動物霊"")",2026-02-05T23:51:59Z,2025-12-08T17:30:16-08:00,flickr_public_feed
55080481643,https://live.staticflickr.com/65535/55080481643_1d300fb951_m.jpg,https://www.flickr.com/photos/fuxfoto/55080481643/,..undSie sind sich sicher? You are sure?,almendra portrait treppenhaus,"nobody@flickr.com (""gunnar_fuchs"")",2026-02-05T23:12:31Z,2019-11-06T13:59:07-08:00,flickr_public_feed
55080505668,https://live.staticflickr.com/65535/55080505668_e4cd1aefd6_m.jpg,https://www.flickr.com/photos/stillunusual/55080505668/,Isekado Brewery,japan japantrip japantravel mie mieprefecture 三重県 ise isekadobrewery brewery sakebrewery holiday vacation travel travelphotography travelphoto travelphotograph 2025,"nobody@flickr.com (""stillunusual"")",2026-02-05T23:26:19Z,2025-12-14T16:03:45-08:00,flickr_public_feed
55080565254,https://live.staticflickr.com/65535/55080565254_461f4ee133_m.jpg,https://www.flickr.com/photos/stillunusual/55080565254/,Isekado Brewery,japan japantrip japantravel mie mieprefecture 三重県 ise isekadobrewery brewery sakebrewery holiday vacation travel travelphotography travelphoto travelphotograph 2025,"nobody@flickr.com (""stillunusual"")",2026-02-05T23:26:18Z,2025-12-14T16:03:22-08:00,flickr_public_feed
55080561279,https://live.staticflickr.com/65535/55080561279_f0e412b6d3_m.jpg,https://www.flickr.com/photos/204019818@N07/55080561279/,Sunset in the French Alps - Cinematic Landscape,mountain mountains landscape nature outdoor hiking alps alpes france mountainlife adventure travel travelphotography landscapephotography moody cinematic sunrise sunset winter snow fujifim fujifilmxt30 fujixseries filmlook moodytones fujifilm fujix fujifimxt30 filmsimulation classicchrome eterna cinematicphotography storytelling atmosphere filmphotographylook,"nobody@flickr.com (""megaimar13008"")",2026-02-05T23:19:56Z,2026-01-10T17:30:07-08:00,flickr_public_feed
55080310946,https://live.staticflickr.com/65535/55080310946_c0c81a3d11_m.jpg,https://www.flickr.com/photos/stillunusual/55080310946/,Sake tasting,japan japantrip japantravel mie mieprefecture 三重県 ise isekadobrewery brewery sakebrewery sake saketasting holiday vacation travel travelphotography travelphoto travelphotograph 2025,"nobody@flickr.com (""stillunusual"")",2026-02-05T23:26:20Z,2025-12-14T16:05:53-08:00,flickr_public_feed
